_id,search_text,title,link,description,comp_name,email,keywords,founded_year,revenue,funding,No_of_employees,headquarters,telephone_number,contact_person,address,type_or_sector
5eb68bf65c40e7d0d71e7cc5,https://www.southernbiological.com/about-us/,About Us - Southern Biological,https://www.southernbiological.com/about-us/,Southern Biological is a leading hands-on Australian science education company that has been supporting science educators for over 40 years. With an aim to ...,Southern Biological / Cogitamus,nfo@sherlock.bio,"['3b scientific brain model', '3b scientific skeleton model', 'koken pronatis model', 'scientific brain model', 'koken decubitus treatment model', 'koken breast massage model type ii', 'anatomical model', 'skull models', '3b scientific brain', 'scientific tongue model']",['2019'],['None'],None,['11-50'],"['Knoxfield, Victoria']",['+613) 9753 3896'],"['David R. Walt, Deborah Hung, Feng Zhang, Jim Collins, Jonathan Gootenberg, Omar Abudayyeh, Pardis Sabeti, Rahul Dhanda, Todd Golub', 'founder(s)', None]",['None'],"['Biotechnology', 'Health Care']"
5eb68f5da4fd71f5821e7cc5,www.savv-e.com.au/,Savv-e_ An award-winning eLearning Solutions | Savv-e,https://www.savv-e.com.au/,Savv-e is a specialist in eLearning design  development and delivery with extensive experience in a range of industries. Find out how we can help you today.,Savv-E,karl@ewave.com,"['good business', 'digital learning design', 'other businesses', 'business goals', 'many businesses', 'workplace culture', 'business environment', 'business', 'accessible learning experiences', 'strategic business goals']",['1999'],['$4.4M'],$0,['101-250'],"['Sydney, NSW']",['+61 2 9901 4522'],"['Lisa Vincent - Co-', 'CEO', None]","['Level 6/11-17 York St, Sydney NSW 2000, Australia']","['B2B', 'Digital Marketing']"
5eb690478934691bf01e7cc5,http://jumpswimschools.com.au/,JUMP! Swim Schools: Swimming Lessons for babies_ infants ...,https://jumpswimschools.com.au/,Skip to content. JUMP! Swim Schools Logo. Search for: Search for: Enrol Now · Lessons · Swimming Babies · Duckling (3-9 months) · Duck (10-24 months) ...,JUMP! Swim Schools,['southmorang@jumpswimschools.com.au'],"['swim schools jump', 'swim schools nerang jump', 'swim school jump', 'swim schools seven hills jump', 'swim schools fyshwick suppliers jump', 'school jump', 'swim schools family', 'swim schools', 'swim schools program', 'swim schools sites']",['2010'],"['$441,000.00USD']",None,['51-200'],"['Surfers Paradise, Queensland']",[['+64-33381795']],"['CEO Ian Campbell', 'CEO', None]",['Seven Hills St Marys Villawood WA'],['Recreational Facilities & Services']
5eb6913eabf312822a1e7cc5,http://www.transdata.com.au/,Sonar Technologies: SMART SOLUTIONS IN MOBILITY ...,https://www.sonartechnologies.com/,Formerly Trans-Data Communications Pty Ltd  Sonar specializes in providing mobile task and resource management solutions to businesses of any size  ...,Sonar Technologies Australia,['usa@sonartechnologies.com'],"['device management', 'resource management solutions', 'efficient device management', 'enterprise technology solutions', 'mobile management application', 'sonar technologies', 'management software', 'field service management software', 'trans-service system', 'application management']",['1991'],['$40.7M'],$0,['51-200'],"['New South Wales, Australia']",['+61 2 9630 3533'],"['Arun Sharma', 'CEO', ['arun.sharma@sonartechnologies.com', 'arun@sonartechnologies.com']]",['MACQUARIE PARK2113New South WalesAustralia'],['Information Technology & Services']
5eb691e4f27c5211d21e7cc5,https://www.starrez.com/,StarRez,https://www.starrez.com/,StarRez is the world-leader in providing student housing software including: online web-based student self-service  built-in reporting  room assignments  ...,StarRez,['maldonadoje@theridernews.com'],"['student housing', 'student housing assignments', 'student housing software solutions', 'student housing providers', 'student housing markets', 'rooms students', 'leading student housing management software', 'continuing student housing applications', 'new student housing sites', 'student information']",['1992'],['$12.5M'],$0,['51-200'],['None'],['+61 1800 875 487'],"['Travis Knipe - Chief', 'CEO', None]","['660 Spencer St, West Melbourne VIC 3003, Australia']",['Computer Software']
5eb692b5bb6685adac1e7cc5,www.alphatech.co.nz,Alphatech Systems: Home,https://www.alphatech.co.nz/,alphatech homepage 2.jpg. alphatech homepage ... Alphatech is the Waters agent in New Zealand. For over 50 ... Email sales@alphatech.co.nz. Tel: +64 9 580 ...,Alphatech Systems,['sales@alphatech.co.nz'],"['meter kit', 'conductivity meter kit postal address electrode', 'ec1100-s meter kit', 'oxygen data meter kit', 'oxygen meter kit deionised water', 'waterproof handheld data meter kit blue', 'ssi tip 10ul', 'ssi tip 200ul', 'kit', 'ssi tip 1250ul']",['24 February 2005'],['$10M'],$0,['10'],['New Zealand'],['2018-09-18'],"['Bryce Roberts', 'CEO', None]","['41b Sale Street, Cockle Bay, Auckland2014NZ']","['Manufacturing, Services - professional, scientific, and technical']"
5eb693d2d045d59f3b1e7cc5,https://invitro.com.au/our-company/,Our Company - In Vitro Technologies,https://invitro.com.au/our-company/,JJ Richards & Sons Pty Ltd was established in 1932 and is the largest privately owned waste and environmental management company in Australia  employing ...,In Vitro,['service@invitro.com.au'],"['medisafe distal duck', 'vitro technologies', 'medisafe duck', 'equipment ivt', 'vitro technologies customer care', 'medisafe distal duck kit', 'vitro technologies technical support', 'vitro technologies women', 'medisafe distal duck tip soaker', 'vitro technologies abn']",['2002'],['None'],None,['51-200'],"['Melbourne, Victoria']",['+61 3 9771 3720'],"['Thomas Axelsson', 'CEO', None]","['11 Canvale Road, Canning Vale, WA']",['Biotechnology']
5eb6950c33fb947c391e7cc5,http://www.skwirk.com.au/,Skwirk | Online Education,https://www.skwirk.com.au/,Skwirk is an award winning learning resource providing educational content for both students & teachers. We cover Maths  English  Science  History  Geography ...,Skwirk,['info@skwirk.com.au'],"['skwirk content', 'skwirk account', 'law skwirk', 'skwirk parent', 'skwirk team', 'skwirk experts', 'skwirk school subscription', 'purchasing skwirk', 'whilst skwirk', 'individual skwirk resources']",['2005'],['$5M'],$0,['11-50'],"['St. leonards, NSW']",['1800 759 475'],"['Joe Bottomley ', 'Relationship Manager_Skwirk ...', None]","['101/52 Atchison St, St Leonards NSW 2065, Australia']",['Education Management']
5eb695e258473bd2511e7cc5,http://www.peak-care.com.au/,Peak Care,http://www.peak-care.com.au/,Shop Now. Bathroom & Toilet · Bedroom · Daily Living Aids · Manual Wheelchair · Patient Handling · Powered Mobility · Seating  Pressure Care & Positioning ...,Peak Care Equipment,['None'],"['peak care support team peak care equipment', 'peak shoe helper peak general', 'peak care', 'peak care members', 'peak care equipment', 'peak', 'merits peak care pioneer', 'peak general', 'peak general purpose', 'peak meteor']",[' 2 March 2015'],['None'],None,['11-50'],"['Unanderra, NSW']",['+61 2 4272 2688'],"['Chris Jones', 'CEO', ['cjones@peak-care.com.au']]","['1/149 Princes Hwy, Unanderra NSW 2526, Australia']",['Hospital & Health Care']
5eb6968b400af16b271e7cc5,http://www.awareim.com/,Aware IM | Web Application Builder - Web application ...,https://www.awareim.com/,Apr 4  2020 - Web Application Builder to Build rich web database applications in a fraction of the time. No programming  database  web or user interface ...,Awaresoft,['None'],"['aware im gantt chart aware im', 'aware im runtime supplemental license terms aware im', 'aware im features', 'aware im database', 'aware im development', 'aware im runtime', 'aware im developers', 'us aware im', 'aware im prices', 'aware im applications']",['18 September 2019'],['None'],None,['None'],['None'],['2019-11-04'],['None'],['None'],"['IT - Software, Mining, oil and gas']"
5eb69733109de20b7e1e7cc5,http://www.grunbiotics.com/,Grunbiotics,http://www.grunbiotics.com/,Grünbiotics is an Australian biotechnology company that develops Medical Nutrition products that improve the quality of life for people with chronic diseases and ...,Grünbiotics,info@grunbiotics.com,"['medical food products', 'beneficial medical food products', 'medical foods medical foods', 'grünbiotics products', 'quality medical nutrition products', 'special medical purpose products', 'medical nutrition products', 'medical food', 'developed quality medical nutrition products', 'medical nutrition market research']","['Jan 1, 2011']",['None'],None,['1-10'],"[' Melbourne, Victoria, Australia']",['+61 3 8692 0006'],"['Jamie Hughes', 'founder', ['jhughes@grunbiotics.com']]","['West Podium, Mezzanine, 2/525 Collins St, Melbourne VIC 3000, Australia']","['Biotechnology', 'Nutrition']"
5eb697d1fb1caa3d7c1e7cc5,www.bioproton.com.au,Feed supplements | Bioproton_ a world leading manufacturer,https://www.bioproton.com.au/,Bioproton is committed to developing  manufacturing and marketing of high quality feed ... in our production facilities in Kaarina Finland and Brisbane Australia.,Bioproton,['None'],None,['1984'],"['$913,060.00USD']",None,['11-50'],['Australia'],['+61 7 3344 1490'],"['Juhani von Hellens ', 'Manager_Bioproton Pty Ltd', None]","['55 Dulacca St, Acacia Ridge QLD 4110, Australia']",['Biotechnology']
5eb6988dc9615b33321e7cc5,http://www.durapol.com.au,DURAPOL PTY LTD,http://www.durapol.com.au/,Durapol is Australia's only manufacturer of EPDM rubber wetpour. For over twenty years our Sydney facility has produced one of the playground industry's most ...,Durapol,['sales@durapol.com.au'],"['durapol epdm', 'epdm rubber wetpour', 'wetherill park epdm specialists', 'the durapol epdm colour range', 'durapol', 'standard colour palettes', 'our epdm colours', 'measurably superior epdm granules phone', 'australia', 'a premium epdm granule']",['2000'],['None'],None,['11-50'],['None'],['+61 2 9756 4105'],"['Michael Lee ', 'Sales Manager_Durapol Limited', None]","['21-23 Daniel St, Wetherill Park NSW 2164, Australia']",['Chemicals']
5eb69968d9785183931e7cc5,https://www.neurocaregroup.com/home.html,neuroCare Group: Home,https://www.neurocaregroup.com/,neuroCare Group is a global brand in neuromodulation therapies  promoting only evidence-based protocols in rTMS  Neurofeedback and tDCS. We are active in ...,Neurocare,['widerspruch@neurocaregroup.com'],"['die de techniek van', 'die van leerkrachten', 'die nutzung der', 'die einbindung der', 'die neurocare group gmbh', 'de hoogte van de', 'de loop van de', 'die', 'van de neurocare group nederland', 'die zusendung von newslettern']",[' 9 April 1993'],['$'],$0,['51-200'],"['Bondi New South Wales, AU']",['+61 1300 149 300'],"['BILL MAYER', ' agent_active', None]",['None'],['Mental Health Care']
5eb69a96a657bfc8991e7cc5,www.thecountrycaregroup.com.au/,https://www.thecountrycaregroup.com.au/Assets/mass...,https://www.thecountrycaregroup.com.au/Assets/mass/Nov2014FB/MASSProductCatalogue2014.html,No information is available for this page.Learn why,Country Care Group,['None'],None,[' 4 December 2018'],['$95.9M'],$0,['51-200'],"['Mildura, Victoria']",['+61 1800 843 224'],"['Robert Hogan', 'Managing_Director', None]",['None'],['Health Care']
5eb69c9f160e789d7e1e7cc5,https://www.bounceinc.com.au/,BOUNCE Inc Australia | Trampoline Parks Around Australia,https://www.bounceinc.com.au/,Fly through the air and bounce off the walls. BOUNCE Inc is a massive indoor trampoline park for all ages with venues around Australia. Book online now!,Bounce,contact@joinbounce.com,"['bounce squad participants', 'classic bounce parties', 'mini bounce squad participants', 'mini bounce squad', 'bounce logo', 'sale bounce', 'bounce memberships', 'bounce sessions', 'ninja squad bounce inc', 'classic bounce logo']",['2016'],['$5M'],$0,['11-50'],['New Zealand'],['+61 3 5461 1254'],"['Maria Smith', 'CEO', None]","['62 Sutton Rd, Maryborough VIC 3465, Australia']","['Information Technology', 'Ride Sharing']"
5eb69d5dd8d4ba89261e7cc5,http://www.scopeiteducation.com.au/,Digital Technologies | ScopeIT Education | Australia,https://www.scopeiteducation.edu.au/,ScopeIT Education is Australia's leading digital technologies educator for primary schools and high schools. Need to address 100% of the digital technologies ...,ScopeIT,['None'],"['digital technologies learning journey', 'digital technologies education', 'scopeit education lessons', 'emerging digital technology learning platforms', 'classroom teacher', 'high school students', 'new digital technologies courses', 'australian students', 'digital technologies courses', 'student learning gains']",['2006'],"['$127,000.00USD']",None,['51-200'],"[' Melbourne, Victoria, Australia']",['1300 300 273'],"['Bagińska Lucyna', 'Proprietor', None]",['None'],['Financial Services']
5eb69e1a46e5e5f33b1e7cc5,www.agmfoods.com,Grainfields Australia,https://www.agmfoods.com/,unique only to A.G.M. FOODS Pty. Ltd. This process ensures active  viable bacteria and predigested  natural nutrients. Only the finest grains  legumes  grasses  ...,AGM Foods,contact@agmindustriesinc.com,"['other fermented foods', 'fermenting foods', 'good food', 'fermented probiotic foods', 'fermented food recipes', 'other foods', 'simple fermented food', 'many foods', 'most fermented foods', 'food products']","['Dec 22, 2009']",['$60B'],$0,['11-50'],['Australia'],['+61 7 3396 2866'],"['Ravi Gajula, Srinivas Rao Elipe', 'founder(s)', None]","['106 Berrima St, Wynnum QLD 4178, Australia']","['Cloud Management', 'Solar']"
5eb69f2843ef874fb81e7cc5,https://www.campion.com.au/,Campion | Education Solutions for Australian Schools,https://www.campion.com.au/,Proudly supplying Australian schools & students with the widest range of publishers  books  digital  stationery and art supplies for over 20 years.,Campion Education,oshc@campaustralia.com.au,"['campion education visit campion education', 'campion education campion', 'school campion education', 'digital publishers campion education', 'campion education contact campion school', 'campion education staff', 'campion education vouchers', 'campion education purchases', 'visit campion education', 'campion education returns']",['1987'],['$79.11 millionUSD'],None,['1001-5000'],"[' Glen Iris, Victoria, Australia']",['+61 3 8851 4100'],"['Robert Morley ', 'General Manager Operations ..._LinkedIn', None]","['6090 Malaga 751 Marshall Road, Malaga WA']","['Child Care', 'Events']"
5eb6a18ae6c27a5e961e7cc5,http://www.studenteducationaladventures.com/about/,Student Educational Adventures,https://www.studenteducationaladventures.com/,Student Educational Adventures. No menu assigned. Student Educational ... Est. Budget & Currency. Message. © 2020 Student Educational Adventures.,Student Educational Adventures,['info@studenteducationaladventures.com'],"['student trips', 'local students', 'students', 'student groups', 'travelling students', 'many students', 'student needs', 'several students', 'student excursion', 'student accommodation']",['1949'],['$2.2B'],$0,['1-10'],"['Kensington New South Wales, AU']",['+61 3 9876 5058'],"['Ian Jacobs', 'CEO', None]","['17 Galtymore Cl, Warranwood VIC 3134, Australia']","['Tourism', 'Travel']"
5eb6a230795dc98ebd1e7cc5,https://www.childcareresourcesaustralia.com.au/,Childcare Resources Australia – Provider of RTO_ Educator ...,https://www.childcareresourcesaustralia.com.au/,Childcare Resources Australia. Whether ... If you're on a computer  you can access the viewer via this link: https://viewer.childcareresourcesaustralia.com.au/#!,Childcare Resources Australia,reception@g8education.com,"['learning resources', 'free educator resources', 'cra learning materials', 'children', 'young children', 'new resources', 'individual children', 'multiple learning guides', 'many children', 'childcare course']",['2006'],['$858.2M'],$0,['5001-10000'],"[' Boondall, Queensland, Australia']",['+61 425 335 729'],"['Karen Atkinson', 'CEO', None]",['None'],"['Child Care', 'Education']"
5eb6a2ee6c39588d0c1e7cc5,https://dobsons.com.au/about/heritage/,The Dobsons Heritage | Learn Our Origins & Principles,https://dobsons.com.au/about/heritage/,In 1918 from humble beginnings Thomas Walter Dobson first planted the seed that is now Dobsons Pty Ltd. Opening his first store just 100 meters from our ...,Dobsons,committee@startuptasmania.com,"['college store', 'bayside college store', 'brauer college store', 'norwood secondary college store', 'mordialloc college store', 'eltham college store', 'bucket hat junior norwood secondary college ballarat clarendon college store', 'dobsons pty limited', 'dobson sports short dobsons head', 'ballarat clarendon college store']",['2010'],['$2.59 millionUSD'],None,['1-10'],"[' Hobart, Tasmania, Australia']",['+61 3 9819 1122'],"['David C. Dobson', 'CEO', None]","['667 Glenferrie Rd, Hawthorn VIC 3122, Australia']","['Communities', 'Information Technology']"
5eb6a3d924946bdefc1e7cc5,https://www.wisenet.co/about-us,About Wisenet | Cloud-based LRM,https://www.wisenet.co/about-us,My Co-founder Kim was teaching Hospitality at college  and I was teaching ... what Wisenet is today - a multi-national company offering our unique cloud-based ...,Wisenet,['None'],"['wisenet data', 'other wisenet users', 'other wisenet products', 'wisenet service', 'wisenet', 'wisenet cloud', 'wisenet users', 'wisenet api', 'integration wisenet', 'wisenet enrolments']",['1997'],['$3M'],$0,['11-50'],"[' Melbourne, Victoria, Australia']",['None'],"['Ben Hamilton', 'CEO', ['ben@wisenet.co']]",['None'],"['Information Technology', 'SaaS']"
5eb6a504d1511c119a1e7cc5,http://www.pcschool.net/company/about-us,About Us – PCSchool,https://www.pcschool.net/company/about-us,PCSchool is a fully integrated  cost effective  school administration package  based on ... His wife Baby also joined the company as a programmer and analyst.,PC School,info@school-space.org,"['pcschool nz pcschool', 'pcschool users', 'pcschool customers', 'pcschool payroll', 'communication pcschool conference', 'other pcschool users', 'queensland pcschool', 'pcschool delivery', 'pcschool annual conference', 'pcschool software development blog']",['2011'],['None'],None,['11-50'],['None'],['360037573391'],"['Jemma Phibbs', 'founder(s)', None]","['229 Australia St, Newtown NSW 2042, Australia']","['Association', 'Communities']"
5eb6a5c37baf5cbfaa1e7cc5,https://ranier.com.au/,Ranier Design Group,https://ranier.com.au/,creating uniforms to excite inspire and unify. Login for students/parents or sign up here. Email: Password: home · about us · services · orders & appointments ...,Ranier Design Group,['career@ranier.com.au'],"['ranier design group services', 'school uniform shops', 'ranier design group', 'school uniforms', 'new uniform designs', 'ranier design group brochure order', 'uniform shop solutions', 'schools', 'uniform shops', 'online uniform shop']",['1995'],['$10M'],$0,['11-50'],['None'],['+61 2 8337 7200'],"['Matt Parass', 'CEO', None]","['114 Rothschild Ave, Rosebery NSW 2018, Australia']","['Hospital', 'Medical']"
5eb6a670bc98e2e1471e7cc5,https://www.woodsfurniture.com.au/,Woods Furniture,http://www.woodsfurniture.com.au/,Australia's leading designer  manufacturer & supplier of high quality educational furniture since 1953. Thank you for making it easy to purchase chairs to match ...,Woods Furniture,custserv@howardproducts.com,"['seater woods furniture', 'woods educational furniture', 'woods furniture customers', 'woods furniture offer', 'sales@woodsfurniture.com.au woods furniture', 'classroom storage furniture', 'mm woods furniture pty ltd', 'woods furniture pty ltd', 'woods furniture mini block ottoman', 'woods storage']",['1969'],['None'],None,['11-50'],['None'],['+61 3 9316 0600'],"['Don Wood', 'founder(s)', None]","['564 Geelong Rd, Brooklyn VIC 3012, Australia']","['Consumer Goods', 'Health Care']"
5eb6a7b02266f527831e7cc5,http://au.elevateeducation.com/about,About | Elevate Education,https://au.elevateeducation.com/about,Each year  over 1400 Australian high schools choose Elevate Education for one key reason: each program actually works! Elevate's study skills seminars are ...,Elevate Education,info.us@elevateeducation.com,"['school students', 'helping students', 'students', 'other students', 'top students', 'work students', 'past high school students', 'student performance', 'young students', 'high impact student']",['2001'],['$2.18 millionUSD'],None,['51-200'],"['Redfern, NSW']",['+61 1300 667 945'],"['Douglas Barton', 'founder', ['douglas@elevateeducation.com']]","['3/414 Bourke St, Surry Hills NSW 2010, Australia']",['Education']
5eb6a895c2e3166bcc1e7cc5,https://www.axcelerate.com.au/about/,About Us - Who is aXcelerate?,https://www.axcelerate.com.au/about,We are dedicated to providing solutions for RTOs  training organisations and enterprises through our end-to-end student management system.,Axcelerate,['greg.hockey@wavetraining.com.au'],"['axcelerate manage student payments', 'student management systems', 'new students', 'student data', 'vet students', 'student assessment software', 'student information', 'home student assessments', 'student management software systems', 'students rto management software']",['2010'],['$15.1M'],$0,['11-50'],"['Milton, QLD']",['+61 7 3215 8888'],"['Reay Mackay', 'Managing_Director', ['reay.mackay@axcelerate.com.au', 'reay@axcelerate.com.au']]","['11 Camford St, Milton QLD 4064, Australia']",['Education Management']
5eb6a9f32ea14a40531e7cc5,https://www.alintaapparel.com.au/about-us/,Alinta Apparel,https://www.alintaapparel.com.au/,Alinta Apparel is a quality bespoke uniform manufacturer and retailer. ... Contact one of our Uniform Specialists today to discuss how we can help your school or ...,Alinta Apparel,['lee@alinta.com'],"['enquiries store information alinta sportswear online shops', 'new zealand office alinta schoolwear', 'navigation alinta leavers view', 'alinta express', 'uniform solutions', 'alinta apparel', 'a quality bespoke uniform manufacturer', 'media', 'australia office', 'alinta']",['1995'],['$1.7B'],$0,['501-1000'],"[' Sydney, New South Wales, Australia']",['+61 2 4321 0433'],"['Simon Neylan - Founder', 'founder', None]","['Shop5/8 Stockyard Pl, West Gosford NSW 2250, Australia']","['Energy', 'Renewable Energy']"
5eb6aa92ee8178abc81e7cc5,http://www.thinksmartsoftware.com/,ThinkSmart Software,https://www.thinksmartsoftware.com/,The ThinkSmart Software Home Page.,ThinkSmart Education,admin@thinksmartusa.com,"['new customers', 'thinksmart software pty ltd software delivery model', 'thinksmart software pty ltd', 'thinksmart software ltd', 'effective business software solutions', 'customer service', 'harmless thinksmart software pty ltd', 'other businesses', 'many other customer requests', 'more customers']",['1998'],"['$821,986.00USD']",None,2-10 employees,"Bundoora, Victoria",+44 (0) 207253,"['Nilesh M Bhattad', 'CEO', 'Achiraya Thianthai', 'Director']",['None'],"['CRM', 'Cyber Security']"
5eb6ab66c0c668b01d1e7cc5,http://astrislifecare.com.au/,Astris Lifecare,https://www.astrislifecare.com.au/,"Thomas Holt - Flame Tree is a uniquely built home and is one of Australia's first aged care homes designed as a ""smart building"". Live Care 360 has been ...",Astris Lifecare,helpdesk@lifecare.com,"['hire care astris lifecare', 'astris lifecare', 'care products', 'personal information', 'tim.little@astrislifecare.com.au astris lifecare', 'astris lifecare permission', 'patient care equipment', 'astris lifecare pty ltd.', 'wendylett base sheet astris lifecare', 'pressure care solutions']",['1984'],['None'],None,51-200 employees,"Silverwater, NSW",+61 2 9714 1100,"['Craig Anderson ', 'General Manager Operations ..._LinkedIn', ['craig.anderson@astrislifecare.com.au']]","['5 Millennium Ct, Silverwater NSW 2128, Australia']","['Human Resources', 'Loyalty Programs']"
5eb6b0e61efe4c8c1f1e7cc5,http://www.sportstek.net/index.htm,Sportstek Physical Therapy Supplies Pty Ltd,http://www.sportstek.net/index.htm,Oct 23  2017 - Australias largest range of physical therapy supplies and equipment  supplying physiotherapists  chirpractors  osteopaths  podiatry  and fitness ...,Sportstek Physical Therapy Supplies,info@isokineticsinc.com,None,['1987'],['None'],None,2-10 employees,"Oakleigh, VIC",+61 3 8330 9524,"['Alison Irene STRONG', ' director_inactive', None]","['6 Park Rd, Oakleigh VIC 3166, Australia']",['Medical']
5eb6b168313d3030621e7cc5,http://www.saxonagencies.com.au/About_Us,About Us - Saxon Agencies,https://saxonagencies.com.au/About_Us,Our focus in the marketplace is to supply Veterinary Practitioners across Australia with a complete range of disposables  consumables and related products with ...,Saxon Agencies,['info@saxonagencies.com.au'],"['saxon agencies pty ltd', 'saxon agencies pty ltd.', 'saxon agencies', 'us saxon agencies login', 'saxon', 'single person veterinary practices', 'veterinary practices', 'veterinary wholesaling', 'ongoing product development', 'veterinary wholesaling company']",['2001'],['$3M'],$0,['24'],"['North Sydney New South Wales, AU']",['+61 2 9832 2700'],"['KATHERINE DENISSE DODDS', 'Director', None]","['173 Power St, Glendenning NSW 2761, Australia']","['Finance', 'Financial Services']"
