_id,search_text,title,link,description,comp_name,email,keywords,founded_year,revenue,funding,No_of_employees,headquarters,telephone_number,contact_person,address,type_or_sector
5eb62e2a134cc6fb9536e93d,https://www.2and2.com.au/about/what-we-do,2and2,https://www.2and2.com.au/,We create beautiful games and apps that help people learn new things  change behaviours and live healthier lives.,2 and 2,info@2and2.com.au,"['behaviour change games', 'custom learning games', 'online game', 'educational games awards', 'social games', 'educational games', 'game design', 'mentored game design students', 'mainstream games awards', 'educational mobile games']",['2007'],['None'],None,['11-50'],"[' Chippendale, New South Wales, Australia']",['+61 1300 883 974'],"['Leon Young', 'CEO', ['leon.young@2and2.com.au', 'leon@2and2.com.au', 'leon@leonyoung.com', 'leon.young@change2.com.au', 'leon@cogniss.com']]","['5 Blackfriars St, Chippendale NSW 2008, Australia']","['Communities', 'Education']"
5eb630147afe26eca4ba7bfa,https://www.answersportals.com/,Answers Portals - A One stop shop for assignment and ...,https://www.answersportals.com/,Answers Portals provides one of the best level service to clients in making there assignments and projects.,Answers Portals,answersportals@gmail.com,"['students assignments', 'management accounting assignment help', 'best assignment help', 'sql assignment help', 'electrochemistry homework assignments', 'college students', 'full assignment help', 'expert business management assignment', 'management assignment problems', 'chemical engineering game theory college assignment tutors']","['Feb 25, 2015']",['None'],None,['None'],"[' Sydney, New South Wales, Australia']",['None'],"['C T CORPORATION SYSTEM', ' agent_active', None]",['None'],"['Association', 'Education']"
5eb6311c86662885174692de,https://arludo.com/,Arludo,https://arludo.com/,We help teachers engage students in their learning. Our library of apps and worksheets quickly turn your students into a class of collaborating scientists.,arludo,['None'],None,"['Jul 1, 2015']",['None'],None,['2-10'],"[' Sydney, New South Wales, Australia']",['None'],"['Michael Kasumovic', 'founder', ['michael@arludo.com']]",['None'],['EdTech']
5eb631f1fac479799dedd1f8,www.assignmenthelpservices.com/,Assignment Help Services,https://www.assignmenthelpservices.com/,Assignment Help Services. Our Platform Connects You With Numerous Online Assignment Help Experts Instantly!! Most of students struggle with doing proper ...,Assignment Help Services,support@assignmenthelpservices.com,"['assignment writing help', 'engineering assignment help', 'academic assignment writing', 'finance assignment help', 'nursing assignment help', 'best assignment', 'academic assignments', 'biology assignment help', 'civil engineering assignment help', 'various assignments']","['Feb 4, 2014']",['$2M'],$0,['101-250'],"[' Perth, Western Australia, Australia']",['730-407-305'],"['Online Assignment Help ', 'Manager_www ...', None]",['None'],"['Consulting', 'Continuing Education']"
5eb6331597c8f5512179c4f1,https://getatomi.com/,Atomi | Learning made easy,https://getatomi.com/,An online teaching and learning platform for students  teachers and schools.,Atomi,['support@getatomi.com'],"['school time', '’s time', 'student learning', 'atomi content', 'study time', 'atomi any questions', 'atomi lessons', 'video atomi', 'more students', 'student personal information']",['2013'],['None'],None,['51-200'],"[' Ultimo, New South Wales, Australia']",['+61 3 9133 5100'],"[""Rob Barakat, Thomas O'Donahoo"", 'founder(s)', ['rob@getatomi.com', 'rob@getatomi.com.au']]","['25/15 Ricketts Rd, Mount Waverley VIC 3149, Australia']","['E-Learning', 'EdTech']"
5eb634492802acb8c48e02aa,www.schoolappsolution.com.au,School App Solution: Parent Communication & Engagement,https://www.schoolappsolution.com.au/,We place no School App Solution branding in the app. Push NotificationsInstant Communication. Small messages sent instantly to mobile phones running your ...,School App Solution,contact@schoolappsolution.com.au,"['school app pricing locations app', 'schools', 'school year', 'school record', 'affordable school app', 'contact school app solution', 'specific notification groups', 'contact school app solution on affordable school app', 'newsletters home page slideshow other links easy', 'dec school website service calendar']",['2015'],['$4.4M'],$0,['62'],"[' Sydney, New South Wales, Australia']",['1(800)547-077'],"['Vikash Jangid -', 'CEO', None]",['None'],"['EdTech', 'Internet']"
5eb63539be65b70e5af0c7a9,www.australianassignmentshelp.com/,Australian Assignment Help - Best Assignment Writing Service,https://www.australianassignmentshelp.com/,At Australian Assignments Help  All Your Academic Needs Are Covered Under One Roof! The major issue that many Australian students face is to find a legitimate ...,Australian assignments help,australianassignmenthelp1@gmail.com,"['assignment writing paper', 'writing assignments', 'best college assignment writing paper', 'best cheap assignment writing help', 'cheap assignment writing services', 'assignment paper', 'best assignment', 'assignment help australia', 'best assignment help', 'best quality assignments']","['Feb 1, 2015']",['$326.2M'],$0,['51-100'],['None'],['None'],"['Elizabeth Mailey ', 'Content Writer_Self', None]",['None'],['Education']
5eb6363894bd0b097f9c2734,australianhelp.com/,Australian Help: Assignment & Essay Writing Services by ...,https://australianhelp.com/,Professional academic writing service for every kind of assignment. Team of our writers is covering any subject  difficulty level and due date. Get 18% OFF!,Australian Help,support@australianhelp.com,"['custom written papers', 'writing professional academic writing service', 'assignment writing services', 'other aussie writing services', 'book report writing service', 'writing help', 'good service', 'writing services', 'good papers', 'case study writing tasks']","['Sep 15, 2008']",['None'],None,['2-10'],"[' Sydney, New South Wales, Australia']",['239093 4.44'],['None'],['None'],"['E-Commerce', 'Education']"
5eb6378b772150870b5c8d27,www.beautycoursesonline.com/,Beauty Courses Online - Complete your beauty course at ...,https://www.beautycoursesonline.com/,Oct 21  2019 - Beauty Courses Online offers a Thirty Day Money Back Guarantee if you believe that these courses are not right for you….Simply contact me ...,Beauty Courses Online,support@fragrancesandcosmetics.com.au,"['online beauty courses', 'other beauty training courses', 'professional beauty courses', 'online nail courses', 'many other beauty courses', 'online nail training courses', 'beauty course', 'other accredited beauty courses', 'online courses', 'online training courses']",['2004'],['$256.3M'],$14K,['1-10'],"[' Melbourne, Victoria, Australia']",['+61 3 9499 9202'],"['Aurelian Lis', 'CEO', None]","['71b Silverdale Rd, Eaglemont VIC 3084, Australia']","['Beauty', 'Cosmetics']"
5eb639ee2c60aae411d1ae8b,brainpump.net/,Brain Pump - Learn something new,http://brainpump.net/,Learn something new and feed your curiosity with Brain Pump. Learn from a vast library of entertaining videos on topics ranging from Chemistry  Physics and ...,Brain Pump,hello@brainpump.net,"['crash course world history', 'crash course biology #', 'crash course biology', 'world history', 'crash course psychology', 'crash course', '#', 'crash course astronomy', 'psychology #', 'earth lived history']","['Sep 1, 2014']",['$43.9M'],$0,['157'],"[' Sydney, New South Wales, Australia']",['None'],"['PANLERT PRAPATSORN', 'Managing Director', None]",['None'],"['Education', 'Software']"
5eb63aff81de1c4846fd91ab,www.careercake.com/,Careercake | Watch Awesome Careers Content Anytime ...,https://www.careercake.com/,Watch awesome careers content created to help you take on  rise to and beat the challenges you'll actually face at work. Subscribe today for on demand access.,Careercake,['hello@careercake.com'],"['other people', 'new people', 'great people', 'careers videos', 'people managers', 'careercake content', 'career development content', 'many people', 'careercake videos', 'different people']",['2010'],['None'],None,['2-10'],"[' Cardiff, New South Wales, Australia']",['303 123 1113'],"['Aimee Bateman', 'CEO', ['aimee@careercake.com']]",['None'],"['E-Learning', 'Education']"
5eb63c1e9c69232f6ed6edd8,centralinnovation.com.au/,Central Innovation,https://centralinnovation.com.au/,CAD Software. Central Innovation sources  build and advises on world-class design process solutions to the manufacturing and construction industries.,Central Innovation Pty Ltd.,sharp.task@centralinnovation.com.au,None,['1990'],['$20M'],$0,['51-100'],"[' Pymble, New South Wales, Australia']",['+61 1300 423 372'],"['Max Piper', 'CEO', ['max.piper@centralinnovation.com', 'mpiper@centralinnovation.com', 'max.piper@centralinnovation.com.au']]","['Suite 63, Building 6/195 Wellington Rd, Clayton VIC 3168, Australia']","['Information Services', 'Information Technology']"
5eb63d1b9d2ec0b892c42dd5,www.c-learning.com.au/,C-Learning - Home,https://www.c-learning.net/,Drop into the #virtualstaffroom. Every weekday  from midday  educators drop into the open virtual staffroom to connect  share and listen to how others are ...,C-Learning Pty,info@c-learning.com.au,"['google suite', 'google technology', 'google apps data', 'google classroom g suite', 'google apps', 'google', 'google services', 'leading google technologies', 'google premier education', 'leading google solutions']",['2002'],['$12.9M'],$0,['11-50'],"[' Hawthorn, Victoria, Australia']",['+44 1225 863218'],"['Phillip Tutty', 'CEO', None]",['None'],['Education']
5eb63e1ee805d1cff3d80a25,www.complierenterprise.com/,complierenterprise.com - This website is for sale ...,http://www.complierenterprise.com/,This website is for sale! complierenterprise.com is your first and best source for all of the information you're looking for. From general topics to more of what you ...,Complier Enterprise,info@complierenterprise.com,None,"['Dec 30, 2015']",['None'],None,['None'],"[' Kiama, New South Wales, Australia']",['None'],"['Brian Whiteside, Wayne Rochat', 'founder(s)', None]",['None'],"['Enterprise Software', 'Information Technology']"
5eb63ee743b668cb27ef8137,www.compnow.com.au,CompNow - Innovative IT Services & Solutions,https://www.compnow.com.au/,With over 25 years experience in the technology industry  we work with clients & partners to provide tailored services & innovative solutions. Learn more.,CompNow,['lana.greig@compnow.com.au'],"['new technology solutions', 'compnow compnow', 'improved technology solutions', 'technology solutions', 'compnow professional services teams', 'service solution', 'tailored managed service solutions', 'device management services', 'innovative technology solutions', 'tailored technology solutions']",['1991'],['$12M'],$6.5M,['201-500'],"[' Notting Hill, Victoria, Australia']",['+61 3 9684 3600'],"['Daniel Hutchinson', 'CEO', None]","['352 Ferntree Gully Rd, Notting Hill VIC 3168, Australia']",['Information Technology']
5eb640560732058562a400b3,www.convincely.com,Convincely™ - Experience The World's Best Plug-In Sales ...,https://convincely.com/,A complete end-to-end sales funnel for enterprises that's proven to lower customer acquisition costs. Turn visitors into customers by winning their trust with ...,Convincely,support@convincely.com,"['customer experience', 'sales optimization data', 'better customer experiences', 'best practice customer experiences', 'online customer experience', 'data platform', 'clunky customer experiences', 'most conversion rate optimization platforms', 'marketing teams', 'marketing platforms']","['Oct 20, 2018']",['None'],None,['11-50'],"[' Melbourne, Victoria, Australia']",['+61 1300 781 861'],"['Pratik Doshi', 'CEO', ['pratik@convincely.com', 'pratik@convincely.com.au']]","['11/484 St Kilda Rd, Melbourne VIC 3004, Australia']","['Analytics', 'Artificial Intelligence']"
5eb646ce3b4442b4da91c057,CourseLink,Link to Content and Tools | Blackboard Help,https://help.blackboard.com/Learn/Instructor/Course_Content/Create_Content/Create_Course_Materials/Link_to_Content_and_Tools,A course link is a shortcut to an existing area  tool  or item in a course. Example: Link to assignments. You can create all assignments in their own content area.,CourseLink,['None'],"['courselink support courselink support', 'courselink edtech consultations courselink login', 'courselink support', 'courselink', 'courselink visitor accounts', 'courselink visitor', 'contact courselink support', 'contact courselink support modifications', 'opened courselink', 'edtech@uoguelph.ca courselink visitor accounts']",['2014'],['None'],None,['0-1'],"[' Sydney, New South Wales, Australia']",['8 (3200.0.8) 2'],"['Nafis Muntasir ', 'Associate Manager_Mastercard ...', None]",['None'],"['Education', 'Marketplace']"
5eb6479687b6932b9e6de098,www.coursesdirect.com.au,coursesdirect.com.au parked with Netfleet.com.au,http://www.coursesdirect.com.au/,coursesdirect.com.au is currently parked with Netfleet.,Courses Direct,info@coursesdirect.com.au,None,['2008'],['None'],None,['11-50'],"[' Charlestown, New South Wales, Australia']",['1800 663 989'],"['JOHN F HEISS', ' agent_active', None]","['63 Ridley St, Charlestown NSW 2290, Australia']",['Education']
5eb648bf6bc924ef46ab60da,www.cuberider.com/,Cuberider | Launchpad,https://launchpad.cuberider.com/,Launchpad. Email. Password. Sign in. Student Registration.,Cuberider,enquiries@cuberider.com,None,['2015'],['None'],None,['None'],"[' Sydney, New South Wales, Australia']",['+61408458542'],"['Solange Cunin', 'CEO', None]",['None'],"['Education', 'STEM Education']"
5eb64a8e96bdd2bbbb3287e5,devika.com/,Devika | Home,https://devika.com/,The Devika Team over the last year have completely transformed Equalution's internal processes to improve the efficiency and scalability of our business ... We ...,Devika,info@devika.com,"['vr devika', 'devika team', 'devika product', 'other devika companies', 'devika learning', 'evenness devika', 'devika logos', 'devika learning devika', 'found devika', 'planet devika']","['Apr 1, 2016']","['$10,259.00USD']",None,['11-50'],"[' Sydney, New South Wales, Australia']",['+61 1300 338 452'],"['Ken Kencevski', 'CEO', ['ken@devika.com.au', 'ken@devika.com']]","['International Towers, Tower 3, F 25 Exchange Pl, Barangaroo NSW 2000, Australia']","['Augmented Reality', 'Blockchain']"
5eb64bc810a22fecd4eca987,dienstconsulting.com/,Dienst Consulting | Where Service Meets I.T.,https://dienstconsulting.com/,Delivered Differently. At Dienst Consulting we believe that work should always “work” where you do  no matter where you are or on what ...,Dienst Consulting,['accounts@dienstconsulting.com'],"['dienst consulting', 'citrix dienst consulting', 'managed citrix dienst consulting', 'dienst consulting entities', 'email dienst consulting', 'choose dienst consulting', 'last name dienst consulting', 'archive subscribe dienst consulting', 'dienst consulting pty ltd.', 'personal information']",['2012'],['$25.4M'],$0,['11-50'],"[' Perth, Western Australia, Australia']",['+61 1300 487 378'],"['Alan Hodson', 'CEO', ['alan.hodson@dienstconsulting.com', 'alan.hodson@dienstconsulting.com.au']]","['50 St Georges Terrace, Perth WA 6000, Australia']","['Consulting', 'Information Services']"
5eb64cfc8c94747a21f39855,digiskool.co.ke/ austraila,digiSchool websites for people from 15 to 25 years old,https://www.digischoolgroup.com/en/produits,All digiSchool websites for students  high school students  junior high school ... to A levels in the UK  the HSC in Australia  or the High school diploma in the US.,digiskool.co.ke/ austraila,contact@king-theme.com,"['school management', 'total school management', 'smart school management system login form', 'stressful managerial school management issues', 'information management', 'bigbrainz defense', 'school management software email', 'digiskool app', 'digiskool detailed honor code pledge', 'digiskool office address calendar']",['None'],"['$119,474.00USD']",None,['2-10'],"[' Lavington, New South Wales, Australia']",['+254 729 46 75 99'],"['harsh shirohi ', 'Web Developer_Digiskool', None]","['COM. DESA,STR. IONITA MARINCU NR.7 207225, Desa Romania']","['Education', 'Software']"
5eb64e13158973dfa9982019,www.digistorm.com.au/,Digistorm: School Websites_ School Apps & Online Enrolments,https://www.digistorm.com.au/,Digistorm is a leading software developer of school websites  school apps  online enrolment forms and enrolment portals for K-12 schools.,Digistorm,contact@digistorm.com.au,"['school websites', 'school information', 'school website developers', 'school website documentation', 'school app modules', 'leading school systems', 'schools', 'leading k-12 school systems', 'important school app modules', 'developed school app solutions']",['2011'],['$4.5M'],$0,['11-50'],"[' Burleigh Heads, Queensland, Australia']",['+61 7 5508 2929'],"['Tim Oswald', 'Managing_Director', ['tim.oswald@digistorm.com', 'tim@digistorm.com', 'tim.oswald@digistorm.com.au', 'tim@digistorm.com.au']]","['Suite G2/2019 Gold Coast Hwy, Miami QLD 4220, Australia']","['Apps', 'CRM']"
5eb64f4ea0549166c51ca057,www.dynamicwebtraining.com.au/,Dynamic Web Training: Computer and IT Courses in Australia,https://www.dynamicwebtraining.com.au/,Dynamic Web Training is Australia's leading provider of computer training including Microsoft  Excel  Adobe  Web  XERO. Visit us for courses  date and times.,Dynamic Web Training Pty Ltd.,info@dynamicwebtraining.com.au,"['php wordpress training courses', 'training center website design using css course unit', 'training packages indesign training courses unit', 'xero training packages adobe photoshop training courses unit', 'training courses unit', 'html course unit', 'indesign training courses', 'dynamic web training courses', 'type wordpress training courses perth seo training courses', 'wordpress training packages unit']",['2000'],['$1.4M'],$2.8M,['101-250'],"[' North Sydney, New South Wales, Australia']",['+61 1300 888 724'],"['Russell Francis', 'CEO', None]","['level 12/379 Collins St, Melbourne VIC 3000, Australia']","['Consumer Electronics', 'Education']"
5eb650acab06d680d6990351,edflix.com.au/,EDflix | Crunchbase,https://www.crunchbase.com/organization/edflix,EDflix is a trusted online education service that gives HSC students unique access to videos and resources. Sydney  New South Wales  Australia.,EDflix,['info@bartonam.com'],"['top trending companies', 'private companies', 'education companies', 'innovative companies', 'revolutionary companies', 'edtech companies', 'big companies', 'portfolio companies', 'private equity funded companies', 'company tech stack']",['2017'],['None'],None,['11-50'],"[' Sydney, New South Wales, Australia']",['100 118 5 14'],"['Vanessa GREEN', ' director_active', None]",['None'],"['E-Learning', 'EdTech']"
5eb651bc5fa088c453991725,edpotential.com/,EdPotential | Inquire. Analyse. Act.,https://www.edpotential.com/,EdPotential | Inquire. Analyse. Act.,EdPotential,['contact@edpotential.com'],"['student achievement', 'new zealand schools', 'assessment data', 'student performance', 'student learning', 'students', 'student performance problems', 'schools', 'many students', 'student progress']",['2016'],['$2.17 millionUSD'],None,['2-10'],['New Zealand'],['800 433 768'],"['Alan Joyce', 'CEO', None]","['Gracefield Innovation Quarter69 Gracefield Road Lower Hutt,, WELLINGTON, 5010 New Zealand']",['Computer Software']
5eb652de55de509b4a9efaf4,http://edquire.com/edquire/,edQuire - Better decisions. Better learning outcomes.,https://edquire.com/,Observe  measure & intervene in student formative computer learning. Know more about student engagement and learning behaviour.,Edquire,support@edQuire.com,"['other information', 'such information', 'other proprietary information', 'personal information', 'collected personal information', 'such other terms', 'student computer learning', 'disclosing personal information', 'such other third party sites', 'student data']",['2011'],['$1.00 millionUSD'],None,['11-50'],"[' Homebush, Queensland, Australia']",['+61 2 9787 3352'],['None'],"['Level 2 - 41/159 Arthur St, Homebush West NSW 2140, Australia']","['Computer', 'EdTech']"
5eb65433af5bcc3efe32c504,http://www.edval.com.au,Edval – Masters of Timetabling,https://www.edval.education/,logo. About Us. Overview · Integration · Testimonials. What We Do. Overview · Timetabling · Daily Organisation · Student Choices · Edval Interviews · Edval ...,Edval,sales@edval.education,"['live school timetable data', 'school timetabling software', 'schools', 'nsw schools', 'uk schools', 'many schools', 'high school', 'most schools', 'edval choice edval interviews', 'other schools']",['1998'],['None'],$0,['11-50'],"[' Surry Hills, New South Wales, Australia']",['+61 2 8203 5455'],"['Dr Tim Cooper', 'founder(s)', ['tim@edval.com.au']]",['MOUNT GAMBIER5290South AustraliaAustralia'],"['EdTech', 'Education']"
5eb6556c29c37695bc97bec4,emarkingassistant.com/,How to grade papers using Microsoft Word & eMarking ...,http://emarkingassistant.com/,Feel free to send an email to Peter.Evans@eMarkingAssistant.com or use the CHAT button on the right of most pages on this site and I can assist you. Reply ↓ ...,eMarking Assistant,info@emarkingassistant.com,"['emarking assistant using emarking assistant', 'assistant emarking assistant', 'emarking assistant', 'installing emarking assistant', 'emarking assistant podcast', 'confidence emarking assistant', 'macros emarking assistant', 'word contact emarking assistant update', 'assistant document', 'showing emarking']",['None'],['None'],None,['1-10'],"[' Canberra, Australian Capital Territory, Australia']",['+61 (0) 407 742 851'],"['Peter Evans ', 'Educational Technology Specialist ..._LinkedIn', ['peter.evans@emarkingassistant.com', 'peter@emarkingassistant.com']]",['None'],"['Education', 'Service Industry']"
5eb6567909d0de1b6b708cf8,www.equ.com.au/,Equilibrium | Perth's Leading Digital Consultancy,https://equ.com.au/,Aug 1  2019 - e: info@equ.com.au · Contact Us · Subscribe. 1 career opportunity. Join the team · LinkedIn · Instagram · Get In Touch Get in touch. Skip to main ...,Equilibrium,info@equ.com.au,"['user experience design', 'user data', 'user experience', 'website users', 'great user experience', 'stores user data', 'new users', 'customer data', 'customer experience', 'new digital experience']",['1995'],['None'],None,['11-50'],"[' East Perth, Western Australia, Australia']",['+61 1300 720 377'],"['Warren Gibbs', 'Managing_Director', ['warrengibbs@westnet.com.au']]","['5/12 Glasson Dr, Bethania QLD 4205, Australia']","['Advertising', 'Education']"
5eb657e754ee9cbe1a7388c8,essayassignmenthelp.com.au/,Assignment Help Australia - Essay Help - EssayAssignmentHelp,https://essayassignmenthelp.com.au/,Online Essay Assignment Help in Australia - Avail Services Across a Plethora of Topics. Essayassignmenthelp.com.au is australia's best essay help and ...,Essay Assignment Help,['None'],"['assignment writer assignment', 'cheap academic assignment writing help service', 'impeccable assignment writing help', 'physics assignment writing services', 'best myob assignment writing help', 'assignment papers', 'academic assignment online help', 'writing assignments', 'australia assignment help', 'unmatched quality assignment writing help']","['Aug 11, 2017']",['$2M'],$0,['51-100'],"[' Sydney, New South Wales, Australia']",['+61-3-4000-0033'],['None'],['None'],['Education']
5eb65942b46918d079adebe9,fitzroyacademy.com/,The Fitzroy Academy,https://fitzroyacademy.com/,... Purpose Code of Conduct Terms of Use Privacy Policy Contact us. Menu The Fitzroy Academy Fitzroy Academy Sign up Log in Pricing Enterprise Watch ...,Fitzroy Academy,support@fitzroyacademy.com,"['use fitzroy academy', 'fitzroy academy', 'alter fitzroy academy', 'copy fitzroy academy', 'sheets copy fitzroy academy', 'eu gdpr fitzroy academy', 'elliot costello fitzroy academy', 'specific user content', 'academy', 'fitzroy']",['2013'],['$27M'],$0,['2-10'],"[' Collingwood, Victoria, Australia']",['1300 205 170'],"['Will Dayble', 'founder', ['will@willdayble.com', 'will.dayble@gmail.com', 'will@fitzroyacademy.com']]","['88 Nicholson St, Fitzroy VIC 3065, Australia']","['E-Learning', 'EdTech']"
5eb65a927cb5b3a1ff4ae362,www.fluidlearning.com.au,Fluid First Aid: First Aid Courses & Training Brisbane,https://www.fluidlearning.com.au/,1300 976 276 hello@fluidlearning.com.au · Facebook · RSS · Facebook · RSS · 0 Items · Fluid First Aid. Courses · CPR · LVR + CPR · First Aid · Childcare First ...,Fluid Learning Courses Brisbane,hello@fluidlearning.com.au,None,['2010'],['$358.5M'],$0,['1-10'],"[' Brisbane, Queensland, Australia']",['1(300)976-276'],"['Anthony Taylor - Chief', 'CEO', None]",['None'],['Education']
5eb65b645417d406270e7e63,foundr.com/,Foundr - Learn from Proven Entrepreneurs & Startup Founders,https://foundr.com/,Looking To Build And Grow A Successful Business? Foundr is Where Modern-Day Entrepreneurs Go To Learn From Proven Founders. Home Of Foundr ...,Foundr Magazine,support@foundr.com,"['’s unpluggd', '’s plugs', 'more people', 'great people', 'many people', 'new people', 'great strategy people', 'many different people', 'different people', 'other people social skills']","['Mar 5, 2013']",['$450M'],$0,['11-50'],"[' Melbourne, Victoria, Australia']",['+2347064614569'],"['Nathan Chan', 'CEO', ['nathanhchan@hotmail.com', 'nathan@foundr.com']]","['Level 1/60 Wilson St, South Yarra VIC 3141, Australia']","['Digital Media', 'Education']"
